{
  "format": 1,
  "map": "qingshuihe",
  "name": "qingshuihe",
  "shader": "res://style/shaders/cine_cloud.gdshader",
  "camVeil": { "offset": [0.0, 0.0, -0.5], "scale": [4.0, 1.2] },
  "layers": [
    {
      "layer": 0,
      "cards": [
        {
          "p": [-961.6, 540.7, 2685.9],
          "size": [192.8, 192.8],
          "faceYaw": 193.0,
          "axisX": [0.9744, 0.0, 0.225],
          "axisZ": [-0.225, -0.0, 0.9744],
          "custom": [0.11, 0.2, 0.9, 1.0]
        },
        {
          "p": [-1063.4, 467.2, 2708.9],
          "size": [69.7, 38.3],
          "faceYaw": 193.0,
          "axisX": [0.9744, 0.0, 0.225],
          "axisZ": [-0.225, -0.0, 0.9744],
          "custom": [0.23, 0.15, 0.3, 1.0]
        },
        {
          "p": [-1348.3, 407.3, 2571.1],
          "size": [307.6, 153.8],
          "faceYaw": 193.0,
          "axisX": [0.9744, 0.0, 0.225],
          "axisZ": [-0.225, -0.0, 0.9744],
          "custom": [0.37, 0.1, 0.4, 1.0]
        },
        {
          "p": [-1236.8, 668.3, 2513.6],
          "size": [514.2, 185.1],
          "faceYaw": 193.0,
          "axisX": [0.9744, 0.0, 0.225],
          "axisZ": [-0.225, -0.0, 0.9744],
          "custom": [0.41, 0.4, 0.05, 0.6]
        }
      ]
    },
    {
      "layer": 1,
      "cards": [
        {
          "p": [-774.4, 526.6, 2185.2],
          "size": [266.7, 186.7],
          "faceYaw": 193.0,
          "axisX": [0.9744, 0.0, 0.225],
          "axisZ": [-0.225, -0.0, 0.9744],
          "custom": [0.53, 0.18, 0.8, 0.6]
        },
        {
          "p": [-432.9, 512.5, 2150.6],
          "size": [241.7, 132.9],
          "faceYaw": 193.0,
          "axisX": [0.9744, 0.0, 0.225],
          "axisZ": [-0.225, -0.0, 0.9744],
          "custom": [0.67, 0.18, 0.5, 0.6]
        }
      ]
    },
    {
      "layer": 2,
      "cards": [
        {
          "p": [-709.5, 554.8, 1561.7],
          "size": [279.6, 173.3],
          "faceYaw": 193.0,
          "axisX": [0.9744, 0.0, 0.225],
          "axisZ": [-0.225, -0.0, 0.9744],
          "custom": [0.71, 0.15, 0.6, 0.25]
        },
        {
          "p": [-967.2, 490.4, 1297.8],
          "size": [153.8, 76.9],
          "faceYaw": 193.0,
          "axisX": [0.9744, 0.0, 0.225],
          "axisZ": [-0.225, -0.0, 0.9744],
          "custom": [0.79, 0.15, 0.3, 0.25]
        },
        {
          "p": [-1531.1, 547.4, 1062.8],
          "size": [253.1, 101.2],
          "faceYaw": 193.0,
          "axisX": [0.9744, 0.0, 0.225],
          "axisZ": [-0.225, -0.0, 0.9744],
          "custom": [0.89, 0.1, 0.2, 0.25]
        },
        {
          "p": [-1243.9, 491.8, 1079.6],
          "size": [130.2, 65.1],
          "faceYaw": 193.0,
          "axisX": [0.9744, 0.0, 0.225],
          "axisZ": [-0.225, -0.0, 0.9744],
          "custom": [0.95, 0.15, 0.2, 0.25]
        },
        {
          "p": [-212.0, 530.1, 1574.8],
          "size": [298.9, 164.4],
          "faceYaw": 193.0,
          "axisX": [0.9744, 0.0, 0.225],
          "axisZ": [-0.225, -0.0, 0.9744],
          "custom": [0.83, 0.18, 0.5, 0.25]
        }
      ]
    }
  ]
}
